,header,title,favorite,price,category,creator
339,요리/음료・파티플래너 메이랩,"피크닉을 부르는 홈 샌드위치, 전문점의 비법을 가득 담아요!",1868,"월 52,322원",요리/음료,파티플래너 메이랩
340,라이프 스타일・고민수,HIIT로 짧고 굵게! 고효율 운동루틴으로 만드는 비키니바디,1862,"월 30,140원",라이프 스타일,고민수
341,요리/음료・프리미엄 엔게티,싱그러운 과일을 더욱 달콤하게! 프리미엄 수제청 만들기,1859,"월 53,900원",요리/음료,프리미엄 엔게티
342,공예・박은혜,"포근한 니트로 만드는 나만의 글씨, 봉봉메이드 니트레터링 클래스 ",1850,"월 61,900원",공예,박은혜
343,공예・marie,"내가 만드는 작은 세상, 마리와 함께 돌하우스 Tea Room",1843,"월 79,900원",공예,marie
344,공예・딜라잇모모,"반짝반짝 빛나는 젤 캔들, 딜라잇모모와 만들어요.",1838,"월 65,278원",공예,딜라잇모모
345,공예・달빛정원,"프랑스 자수인들의 로망, 스티치북 만들기",1834,"월 44,900원",공예,달빛정원
346,사진/영상・박소영,모션그래픽 훈련! 소스 제작을 포함한 다양한 영상 만들어보기,1839,"월 50,580원",사진/영상,박소영
347,공예・offn,뚝딱뚝딱 내 책상에서 시작하는 미니 가죽공방,1819,"월 79,900원",공예,offn
348,디자인/개발・홍마루,스파인으로 나의 그림에 생명을 불어넣어요!,1813,"월 37,570원",디자인/개발,홍마루
349,공예・가비&,"유리 같이 아슬아슬한 아름다움을 담은 꽃, 가비앤공방의 딥플라워 공예",1818,"월 79,900원",공예,가비&
350,공예・fxng 퐁,"자연과 나를 위한 향기로운 선물, 비건 비누 제작법",1811,"월 54,861원",공예,fxng 퐁
351,음악・임둥,"화려한 불빛의 멜로디, 색다른 전자피아노 런치패드",1817,"월 31,900원",음악,임둥
352,디자인/개발・컨트롤에쓰,"디자인은 '실무자'에게 배우세요, 기본기부터 탄탄한 디자이너가 되기까지",1790,"월 36,900원",디자인/개발,컨트롤에쓰
353,미술・윤이크,"붓과 먹이 만나, 종이 위에 펼쳐지는 나만의 동양화 한 폭",1780,"월 56,900원",미술,윤이크
354,요리/음료・김지나,"한 통에 담기는 다채로운 맛, 카페조말순과 함께 도시락을 만들어요",1763,"월 39,900원",요리/음료,김지나
355,부업/창업/재테크・드로우앤드류,"열정을 돈으로 만드는 기술, 인스타그램 퍼스널브랜딩",1754,"월 43,058원",부업/창업/재테크,드로우앤드류
356,미술・낮잠,"달콤한 낮잠 같은 색으로, 낮잠의 색연필 드로잉",1750,"월 46,887원",미술,낮잠
357,요리/음료・제인,"와인이 아직 낯선 당신을 위해, 지금 만나는 와인 첫걸음",1744,"월 38,900원",요리/음료,제인
358,디자인/개발・무늬상점,"즐거운 무늬라이프의 시작, 패턴디자인부터 패브릭제작까지",1738,"월 50,580원",디자인/개발,무늬상점
359,미술・리곡,"여행, 색으로 기억해요! 리곡과 함께하는 포스터물감 드로잉 ",1737,"월 51,900원",미술,리곡
360,공예・향기로운 블라썸,"무수한 색이 만나 피워내는 한 줄기 빛, 블라썸의 캔들 메이킹",1732,"월 74,900원",공예,향기로운 블라썸
361,미술・레이,"손끝에서 피어나는 아름다움, 레이의 감성 꽃 수채화 일러스트",1734,"월 71,700원",미술,레이
362,공예・orzr(아라),"손으로 짓는 단정한 일상, 손바느질 리넨소품",1728,"월 51,900원",공예,orzr(아라)
363,라이프 스타일・요가소년,"하루 10분, 요가로 찾은 내 몸의 선",1728,"월 30,574원",라이프 스타일,요가소년
364,부업/창업/재테크・미돌남 - 미싱 돌리는 남자,"내가 만든 수공예품, 그림 굿즈, 디지털 파일 판매로 엣시에서 돈 버는 법!",1726,"월 45,632원",부업/창업/재테크,미돌남 - 미싱 돌리는 남자
365,공예・서로스튜디오,All you need is Hand! 서로 스튜디오의 마크라메 홈 인테리어,1720,"월 54,320원",공예,서로스튜디오
366,공예・코구리,인생의 센스는 다이어리에서! 코구리와 다이어리 한 권 완성하기,1715,"월 28,720원",공예,코구리
367,공예・안동동화,"라탄으로 엮는 고풍스러운 나만의 소품, 안동동화의 라탄 공예 클래스",1715,"월 59,925원",공예,안동동화
368,미술・김져니,김져니와 함께 나의 이야기를 남기는 수채화 그림일기,1718,"월 39,900원",미술,김져니
369,라이프 스타일・멍멍슈퍼,"사랑하는만큼 건강하게, 반려견을 위한 저알러지 수제 간식 만들기",1713,"월 25,900원",라이프 스타일,멍멍슈퍼
370,디지털 드로잉・다옹 ,"일러스트와 만화, 그 경계를 허무는 이야기가 담긴 캐릭터 드로잉",1699,"월 50,700원",디지털 드로잉,다옹 
371,디지털 드로잉・김하나,"귀여운 낙서로 돈 버는 법, 캐릭터로 이모티콘 연금 만들기!",1699,"월 51,440원",디지털 드로잉,김하나
372,음악・Superflat,음악을 쉽고 색다르게: 악기 없는 작곡 클래스,1693,"월 38,900원",음악,Superflat
373,미술・NUNU,"물의 번짐도 예술이 된다, 수채화로 펼쳐질 동물 이야기",1695,"월 51,900원",미술,NUNU
374,디지털 드로잉・달콩,"낯설기만 했던 색과 친해지는 시간, 아이패드 색 일러스트",1690,"월 38,880원",디지털 드로잉,달콩
375,디자인/개발・두이,차근차근 배우는 포토샵 툴과 디자인,1681,"월 43,200원",디자인/개발,두이
376,미술・sunny,이명선의 스케치 없이 쉽게 그리는 수채화 일러스트,1680,"월 44,400원",미술,sunny
377,디자인/개발・송호종,Adobe 디자인 트렌드에 소개된 디자이너와 그래픽 아트웍 스킬업하기,1682,"월 49,900원",디자인/개발,송호종
378,공예・라미서울,"내 발걸음이 닿는 곳, 그 이야기를 담는 가죽 가방",1679,"월 42,499원",공예,라미서울
379,공예・자수하는으녕씨,소복소복 바늘 끝에서 피어오르는 자수,1684,"월 39,900원",공예,자수하는으녕씨
380,미술・카콜,카콜과 함께 나만의 감성 하늘을 그려보자,1673,"월 52,046원",미술,카콜
381,공예・포터리쏘,원하는 색감과 디자인으로! 도자기 액세서리 제작법,1673,"월 71,900원",공예,포터리쏘
382,공예・페이퍼 아티스트 사랑,크니까 더 예쁘다! 사랑과 함께하는 자이언트 페이퍼플라워,1678,"월 48,900원",공예,페이퍼 아티스트 사랑
383,운동・듀잇,"Dew it, Do it ! 매일매일 건강해지는 하루 10분 홈트레이닝",1667,"월 42,900원",운동,듀잇
384,미술・크레용토끼,"다채로운 빛이 가득, 크레용토끼의 오일파스텔 풍경화 일러스트",1666,"월 45,900원",미술,크레용토끼
385,사진/영상・Doyou.fim(두유필름),일상을 특별하게 만드는 마법! 사진 & 라이트룸 보정법,1663,"월 44,900원",사진/영상,Doyou.fim(두유필름)
386,미술・보니룸,오일파스텔로 내 사진첩 속 추억을 특별하게 기록해요,1660,"월 55,040원",미술,보니룸
387,미술・김이영,"붓펜으로 그려낸 보통 날, 보통의 글씨",1642,"월 39,900원",미술,김이영
388,시그니처・김규삼,"닮고 싶은, 담고 싶은 웹툰 원고 제작 기법",1635,"월 25,233원",시그니처,김규삼
389,공예・소울스트링,"마음을 두드리다, 못과 실로 엮는 소울스트링의 스트링아트",1623,"월 49,900원",공예,소울스트링
390,공예・지음,"위빙으로 엮는 나만의 패턴, 나만의 소품 - 지음과 함께 힐링 위빙",1601,"월 57,605원",공예,지음
391,디자인/개발・SNL STUDIO,"건축 디자인 All in one, 디자인부터 모델링까지",1588,"월 56,700원",디자인/개발,SNL STUDIO
392,부업/창업/재테크・카인드쌤,"집이 없어도 월세를 받을 수 있는 방법, 쉐어하우스 창업!",1587,"월 43,058원",부업/창업/재테크,카인드쌤
393,공예・NOA,더블디 노아의 감성가득 마크라메 클래스,1581,"월 74,750원",공예,NOA
394,미술・슛뚜,유투버 슛뚜와 함께 아크릴로 그리는 포근한 풍경,1561,"월 42,480원",미술,슛뚜
395,공예・팰롱팰롱빛나는,팰롱팰롱 빛나는 추억을 비누에 담아 기억하고 공유해요.,1566,"월 59,900원",공예,팰롱팰롱빛나는
396,사진/영상・JHN STUDIO(정훈남),정스와 함께 내 손으로 직접 만드는 귀여운 픽셀아트 세계,1568,"월 45,360원",사진/영상,JHN STUDIO(정훈남)
397,"공예・이지, 유어디자인",흙을 도화지 삼다. 나만의 색을 담은 도자기,1569,"월 39,900원",공예,"이지, 유어디자인"
398,라이프 스타일・Mobi 모비,"우아한 레인보우 셀프 염색, 탈색 없이 해볼래요?",1562,"월 70,900원",라이프 스타일,Mobi 모비
399,라이프 스타일・인생관리전문가 박소장,"미루는 습관을 이기고 완벽한 하루를 만들어줄, 인생 관리 시스템",1563,"월 42,900원",라이프 스타일,인생관리전문가 박소장
400,공예・위풍당당그녀,"사소한 것도 특별하게, 위풍당당그녀와 함께하는 보자기랩핑",1555,"월 44,900원",공예,위풍당당그녀
401,공예・홀쥬 ,"부드럽고 따뜻한 그 향기, 필라캔들 그리고 비누",1543,"월 73,900원",공예,홀쥬 
402,디지털 드로잉・제이(Jay),"사물, 인물 그리고 풍경까지! 아이패드 드로잉의 모든 것",1541,"월 38,880원",디지털 드로잉,제이(Jay)
403,공예・스태리라운지,"고요한 시간, 바늘로 그리는 포근한 그림 한 폭",1532,"월 53,900원",공예,스태리라운지
404,디자인/개발・피도리,보노보노는 이제 그만! 피도리의 실전 PPT,1526,"월 39,950원",디자인/개발,피도리
405,공예・신이의 매듭세상,전통매듭으로 설레임을 엮다! 신이의 매듭세상,1522,"월 45,900원",공예,신이의 매듭세상
406,공예・엔원 투엘엘 위빙 ,"실로 그리는 컬러 콜라주, 태피스트리 도형 위빙",1521,"월 36,023원",공예,엔원 투엘엘 위빙 
407,미술・온초람,"여행을 준비하는 설렘을 그대로, 온초람의 여행 마카드로잉",1518,"월 48,900원",미술,온초람
408,공예・미니메이든,"당신의 마음을 채워드립니다, 미니메이든의 맛있는 미니어처",1518,"월 54,900원",공예,미니메이든
409,요리/음료・김밀란,"미슐랭 요리사, 김밀란과 함께 하는 이탈리아 가정식 클래스",1516,"월 43,900원",요리/음료,김밀란
410,디지털 드로잉・몽냥툰_삼일사,소소한 일상을 그리는 몽냥툰과 함께 인스타툰 입문하기,1515,"월 43,880원",디지털 드로잉,몽냥툰_삼일사
411,미술・artye(최예지),"나를 알아가고 기록하는 시간, 위로가 되는 글과 그림  ",1499,"월 51,060원",미술,artye(최예지)
412,부업/창업/재테크・대학생 김머신,11만 유튜버 '대학생김머신'의 무엇이든 팔 수 있는 쇼핑몰 창업 가이드,1481,"월 75,992원",부업/창업/재테크,대학생 김머신
413,요리/음료・꼬야,"맛이 예쁜 아기자기 레시피, 꼬야의 캐릭터 푸드",1490,"월 47,900원",요리/음료,꼬야
414,공예・단디,"액세서리부터 소품까지, 마음을 담아 엮는 전통매듭",1472,"월 51,244원",공예,단디
415,미술・KATH,"좋아하는 음악, 영화, 그리고 사람. 캐쓰와 함께 색연필로 그려요!",1470,"월 51,900원",미술,KATH
416,디지털 드로잉・김마웨(kimmyway),모바일로 그려요!  애니메이션 같은 나만의 캐릭터 만들기,1467,"월 47,440원",디지털 드로잉,김마웨(kimmyway)
417,시그니처・최현우,지금 이 순간 마법 같은 일상,1461,"월 21,233원",시그니처,최현우
418,공예・라탄스튜디오 가람,"내 손으로 만드는 10가지 라탄 소품, 결 따라 엮어내는 하루의 쉼표",1465,"월 51,542원",공예,라탄스튜디오 가람
419,공예・빛을담다,"영롱한 보석 캔들, 방향제, 모빌의 빛과 향기로 공간을 가득 채워요.",1461,"월 67,208원",공예,빛을담다
420,미술・OurWASAB,"한 번의 터치로도  감각 있어 보이는 방법, 미니멀 마카 드로잉",1456,"월 54,900원",미술,OurWASAB
421,디지털 드로잉・시우,클립스튜디오로 처연한 여운이 남는 짙은 감성의 일러스트 그리기,1450,"월 54,720원",디지털 드로잉,시우
422,공예・고니네미,"내 손으로 만드는 작은 세상, 테라리움 만들기",1447,"월 57,900원",공예,고니네미
423,사진/영상・앤돌핀,"홀연히 경이롭게, 일상을 여행처럼. 힐링 사진 촬영과 라이트룸 보정",1445,"월 33,900원",사진/영상,앤돌핀
424,라이프 스타일・이임복,토요일 3시간으로 완성하는 책 출간의 모든 것,1443,"월 42,900원",라이프 스타일,이임복
425,시그니처・코드 쿤스트,코드 쿤스트의 프로듀싱 클래스,1445,"월 28,400원",시그니처,코드 쿤스트
426,디지털 드로잉・최삡뺩,네이버웹툰 작가 최삡뺩의 개그만화 그리기 클래스,1435,"월 39,900원",디지털 드로잉,최삡뺩
427,EASY DIY・리얼브릭,DIY 미니어쳐 미니벽돌 벽난로 키트,1431,"22,900원",EASY DIY,리얼브릭
428,미술・sentiday (센티데이),"마음이 센치해지는 날, 나를 위로해 줄 수채화 리스 그리기",1420,"월 52,900원",미술,sentiday (센티데이)
429,공예・마음을 담은 리네아,"평생 취미가 될 코바늘, 매일 함께할 하나뿐인 가방",1422,"월 62,400원",공예,마음을 담은 리네아
430,라이프 스타일・실버택,도그핏의 애견미용사 실버택이 알려주는 우리집 강아지 셀프미용!,1417,"월 58,900원",라이프 스타일,실버택
431,디지털 드로잉・클래스101,"갤럭시 노트, 잠자던 펜을 깨울 시간",1409,"월 145,336원",디지털 드로잉,클래스101
432,공예・이본느모건 ,20종의 비즈와 스팽글로 완성하는 특별한 입체자수,1415,"월 73,480원",공예,이본느모건 
433,요리/음료・요아마미,맛과 멋을 사로잡는 한식의 품격!,1407,"월 42,900원",요리/음료,요아마미
434,시그니처・성지훈,성지훈의 믹싱 & 마스터링 클래스,1405,"월 39,400원",시그니처,성지훈
435,미술・리버워드,글씨교정으로 또박또박 시작하는 바른 손글씨 생활,1405,"월 39,284원",미술,리버워드
436,공예・미림주인,"세상의 모든 가방, 머릿속에 그리는 대로 만드는 코바늘뜨기",1394,"월 48,437원",공예,미림주인
437,시그니처・홍석천,실패를 줄이는 my 외식업 스토리,1403,"월 22,066원",시그니처,홍석천
438,직무・생각정리스킬 복주환,"일 잘하는 사람들의 생각법, 복주환의 생각 정리 스킬",1392,"월 49,676원",직무,생각정리스킬 복주환
439,공예・수밍,"태팅레이스, 손뜨개로 엮어내는 내 일상 속 소품",1396,"월 46,900원",공예,수밍
440,공예・하라두,"돌돌 감아 완성하는 색다른 매력, 하라두의 코일링을 만나요.",1390,"월 55,386원",공예,하라두
441,사진/영상・신혜림,"느림의 미학, 사진작가 신혜림의 필름 사진",1383,"월 47,340원",사진/영상,신혜림
442,부업/창업/재테크・이학림 디자이너,나만의 철학이 담긴 패션 브랜드 런칭하기 A to Z,1372,"월 39,890원",부업/창업/재테크,이학림 디자이너
443,공예・앙즈,아름다운 정통 프랑스자수를 만나다,1359,"월 66,900원",공예,앙즈
444,요리/음료・티애나,전문 티블렌더와 함께하는 일상 속 Tea Life 만들기,1351,"월 67,000원",요리/음료,티애나
445,미술・dewbox,상상력과 디테일로 그려낼 나만의 수채화 그림일기,1346,"월 44,900원",미술,dewbox
446,요리/음료・쪼자매,"나의 첫 번째 한식 디저트, 쪼자매와 함께 만들어요",1342,"월 44,900원",요리/음료,쪼자매
447,디자인/개발・PUSH THE LEVER,세계 3대 디자인 어워드 수상자와 함께하는 디자인 기초 체력 기르기,1342,"월 44,700원",디자인/개발,PUSH THE LEVER
448,공예・모호자수,"명화와 함께하는 일상, 모호의 명화 프랑스자수",1339,"월 50,524원",공예,모호자수
449,부업/창업/재테크・이은지(은짜언니),"내 재능을 이용한 디지털 파일, 문서로 자동화 수입 만들기!",1335,"월 47,690원",부업/창업/재테크,이은지(은짜언니)
450,미술・ Ssolalee(소라),사랑스러운 순간을 그리고 기록하는 그림책을 만들어요,1335,"월 52,900원",미술, Ssolalee(소라)
451,미술・AY,색연필과 펜으로 감각적인 색감을 찾아 그려보는 여행 그림,1329,"월 45,020원",미술,AY
452,부업/창업/재테크・몰랑이 작가,몰랑이 작가에게 배우는 잘 팔리는 캐릭터 디자인 & 캐릭터 매뉴얼 제작법,1330,"월 51,348원",부업/창업/재테크,몰랑이 작가
453,디자인/개발・레이첼 (Rachel),"YG, SM디자이너에게 배우는 엔터테인먼트 디자인과 비주얼디렉팅 ",1318,"월 47,640원",디자인/개발,레이첼 (Rachel)
454,직무・투마일러(2miler),POWER BI로 배우는 데이터 시각화,1311,"월 36,442원",직무,투마일러(2miler)
455,디자인/개발・김연디,실무 디자이너가 알려주는 어필 잘되는 포트폴리오 만들기,1314,"월 41,220원",디자인/개발,김연디
456,직무・박세진,220문장으로 토익부터 회화까지! 비즈니스 영어 완성,1314,"월 27,188원",직무,박세진
457,공예・끌레드륀느,매듭 하나로 무엇이든 만들 수 있는 마크라메 입문,1307,"월 50,900원",공예,끌레드륀느
458,라이프 스타일・Daniel,아무것도 몰라도 배울 수 있는 스페인어,1283,"월 34,900원",라이프 스타일,Daniel
459,디자인/개발・WOOK_DDD,사진보다 더 진짜 같은 3D 렌더링 (Keyshot 9),1274,"월 48,900원",디자인/개발,WOOK_DDD
460,시그니처・팔로알토,팔로알토의 랩 클래스,1256,"월 26,900원",시그니처,팔로알토
461,공예・벨리아떼,널 '조화'해! 플로리스트 벨리아떼와 함께 조화를 다뤄요.,1253,"월 53,951원",공예,벨리아떼
462,라이프 스타일・먼지나방 스토그래피,매력을 최대치로 끌어올리는 먼지나방의 퍼스널컬러,1242,"월 55,500원",라이프 스타일,먼지나방 스토그래피
463,자기계발・심리멘토 박세니,"멘탈이 바뀌면 인생도 바뀐다, 박세니의 실전 응용 심리학",1228,"월 125,862원",자기계발,심리멘토 박세니
464,공예・모모쥬빌레,"예쁜 것만 볼 수 있도록, 한잎 한잎 클레이크림 플라워",1232,"월 57,900원",공예,모모쥬빌레
465,음악・아야금 AYAGEUM,"만화주제곡부터 영화OST까지, 아야금과 함께하는 25현 가야금",1225,"월 34,900원",음악,아야금 AYAGEUM
466,미술・Findenart 핀든아트,이젠 그림 '잘' 그리고 싶다!  핀든아트의 두 번째 클래스,1213,"월 68,900원",미술,Findenart 핀든아트
467,미술・지희몬,"어릴 적 크레파스의 기억을 되돌리다, 오일파스텔 드로잉",1219,"월 54,900원",미술,지희몬
468,공예・피그말리온,"구체관절인형, 모델링부터 연출까지! 꿈꾸던 인형을 현실에 구현해요.",1211,"월 91,900원",공예,피그말리온
469,공예・mitten ,하루종일 껴안고 싶은 나만의 양모인형  ,1205,"월 53,900원",공예,mitten 
470,직무・그랩,"개발자가 되고 싶은 당신을 위해, 개발자가 되는 로드맵 A to Z",1207,"월 38,972원",직무,그랩
471,공예・페이퍼 아티스트 사랑,"사각사각 종이에 담아낸 행복, 페이퍼 크래프트",1201,"월 39,900원",공예,페이퍼 아티스트 사랑
472,공예・자몽몽,"종이가 색색깔 플라스틱이 되다, 마법같은 슈링클스 공예",1199,"월 51,900원",공예,자몽몽
473,요리/음료・yona,삶의 요령이 쌓이는 채소반찬 요리,1197,"월 46,380원",요리/음료,yona
474,요리/음료・하얀술,직접 피워낸 누룩으로 빚은 내 생애 첫 막걸리,1185,"월 48,900원",요리/음료,하얀술
475,디지털 드로잉・유총총,"쉽고 귀여운 총총툰, 함께 그려봐요!",1114,"월 26,900원",디지털 드로잉,유총총
476,공예・무아랩 ,"아름답고 향기로운 꽃, 드라이플라워로 오래도록",1169,"월 57,900원",공예,무아랩 
477,공예・ bys,시선이 머무르는 나만의 레진 공예 아이템 만들기,1167,"월 61,900원",공예, bys
478,라이프 스타일・옴고묵따,내 안의 우주를 만나는 차크라 요가와 명상,1170,"월 36,900원",라이프 스타일,옴고묵따
479,부업/창업/재테크・알머리 제이슨,"주식투자, 운도 감도 아닌 학습입니다",1158,"월 52,984원",부업/창업/재테크,알머리 제이슨
480,디지털 드로잉・다야(daya),"[MINI] 유명 동화 속 세상, 나의 색감으로 채워내기",1155,"월 26,200원",디지털 드로잉,다야(daya)
481,EASY DIY・버드인페이지,DIY 꽃잎 수채화 컬러링 키트,1146,"22,900원",EASY DIY,버드인페이지
482,미술・클래스101,[자유이용권] 5가지 클래스로 펜과 색연필 즐기기,1152,"월 70,516원",미술,클래스101
483,라이프 스타일・폴소영,"나의 첫 폴댄스, 가장 우아한 근력 운동",1139,"월 37,700원",라이프 스타일,폴소영
484,음악・태경이삼촌,태경이 삼촌의 도 몰라도 미칠 수 있는 코드 피아노 반주법,1134,"월 45,360원",음악,태경이삼촌
485,직무・박창선,[PRO시리즈] 두 번 일하지 않는 디자이너의 커뮤니케이션,1136,"월 36,260원",직무,박창선
486,공예・뜨레드마크라메,"마크라메로 엮는 핸드메이드 가방, 지갑부터 크로스백까지!",1134,"월 51,900원",공예,뜨레드마크라메
487,사진/영상・양품생활,"유튜브 100만 조회수를 만든, 유튜버 양품생활의 리뷰 영상제작의 비밀",1120,"월 42,279원",사진/영상,양품생활
488,디지털기기/ACC・클래스101,가격 절약 아이패드 특가전,1120,"월 33,000원",디지털기기/ACC,클래스101
489,요리/음료・달비케이크,"폭신한 달콤함이 주는 행복, 달비 케이크만의 특별 레시피 비법",1115,"월 35,526원",요리/음료,달비케이크
490,직무・홍석희(킹홍),IT 주니어를 위한 실전 UX 디자인 개론,1110,"월 45,954원",직무,홍석희(킹홍)
491,미술・세레나아트 Serena,"아크릴 물감과 팔레트 나이프, 붓으로 그리는 캔버스화",1113,"월 54,902원",미술,세레나아트 Serena
492,미술・그레이스캘리,취미와 자격증을 한번에! 그레이스캘리의 수채화캘리그라피 자격증 클래스,1113,"월 48,228원",미술,그레이스캘리
493,공예・LEEDA,은은하게 나의 공간을 감싸는 향과 온기,1106,"월 79,900원",공예,LEEDA
494,미술・디자인마노,"오일파스텔로 그리는 칠판그림감성, 디자인마노의 초크아트 클래스",1105,"월 59,900원",미술,디자인마노
495,미술・필림,"글씨의 진한 울림, 필림의 손글씨 교정 클래스",1106,"월 44,900원",미술,필림
496,요리/음료・커픽처스,"취미부터 창업까지, 카페 음료는 '커픽처스'에게 쉽고 꼼꼼하게 배우세요. ",1100,"월 44,900원",요리/음료,커픽처스
497,공예・시은맘,"시은맘의 꼼지락 작업실, 단짝 친구 코바늘 인형 만들기",1093,"월 69,700원",공예,시은맘
498,미술재료・클래스101,"이렇게 멋진 수채화 키트,어때요? 클래스101과 고넹이화방이 기획한 3가지 수채화 키트  ",1087,"45,000원",미술재료,클래스101
499,부업/창업/재테크・진문,판타지 웹 소설 작가 되어 ‘내 글’로 돈 벌어보기,1088,"월 49,676원",부업/창업/재테크,진문
500,미술・클래스101,둡BEST 1+1 연필드로잉부터 채색까지,1087,"월 40,086원",미술,클래스101
501,공예・아기신발한땀,직접 만드는 우리 아이 첫 신발,1087,"월 81,654원",공예,아기신발한땀
502,디지털 드로잉・김아이,"글자에 감성을 담아 써내려가다, 김아이 디지털 캘리그라피",1082,"월 45,026원",디지털 드로잉,김아이
503,디지털 드로잉・일홍,"나를 위로하는 따뜻한 그림, 일홍과 함께 디지털로 그려요!",1074,"월 44,900원",디지털 드로잉,일홍
504,디자인/개발・Force Team Task,"액자 속 움직이는 세상, 증강현실 포스터 만들어보기",1076,"월 44,280원",디자인/개발,Force Team Task
505,부업/창업/재테크・1프로마케터  서동민,쿠팡 파트너스와 제휴 마케팅으로 집에서 월 200만 원 부수익 만들기,1069,"월 43,058원",부업/창업/재테크,1프로마케터  서동민
506,부업/창업/재테크・興하게 도와드리는 흥소장,'브랜드'적으로 사업계획서 쓰는 비결! (+디자인씽킹 +브랜드컨셉 +마케팅 까지),1067,"월 42,986원",부업/창업/재테크,興하게 도와드리는 흥소장
507,사진/영상・단호근,"전 세계 하나뿐인 나만의 색감, 단호근의 파이널컷프로 색보정 클래스",1059,"월 43,900원",사진/영상,단호근
508,요리/음료・Table301,Table301의 특별한 레시피 가득 담긴 수제 카라멜&푸딩 클래스 ,1062,"월 52,900원",요리/음료,Table301
509,공예・달빈,소중한 마음을 담아 만드는 달빈의 재봉틀 클래스,1059,"월 69,900원",공예,달빈
