,header,title,favorite,price,category,creator
0,부업/창업/재테크・신사임당,"스마트스토어로 월 100만원 만들기, 평범한 사람이 돈을 만드는 비법",18974,"월 53,520원",부업/창업/재테크,신사임당
1,미술・둡 ,"연필 하나만으로 모든 분위기를 담아내요, 둡의 연필 드로잉",18190,"월 39,900원",미술,둡 
2,미술・Findenart 핀든아트,"여행 드로잉, 꿈만 꾸지 마세요. 핀든아트와 여행, 그리다",16646,"월 59,900원",미술,Findenart 핀든아트
3,디지털 드로잉・반지수,"일상에 따뜻한 숨결을 불어넣어요, 반지수와 함께하는 아이패드 드로잉",15509,"월 44,900원",디지털 드로잉,반지수
4,미술・집시 zipcy,일러스트레이터 집시의 매력적인 얼굴 그리기 ,13560,"월 49,900원",미술,집시 zipcy
5,사진/영상・슛뚜,일상 유튜버 슛뚜의 감성을 그대로. 영화같은 브이로그 제작법,13250,"월 46,900원",사진/영상,슛뚜
6,사진/영상・존코바,당신도 할 수 있다! 베테랑 실무자가 알려주는 모션그래픽의 모든 것,10812,"월 40,440원",사진/영상,존코바
7,미술・리니,어색한 그림은 이제 안녕! 드로잉 기초부터 시작하는 리니의 펜드로잉,10283,"월 58,800원",미술,리니
8,라이프 스타일・유잰,색다른컬러연구소 유잰의 색 감각 키우기,9819,"월 58,763원",라이프 스타일,유잰
9,사진/영상・MAZECT(마젝),사진 입문자를 위한 쉽게 배우고 빨리 써먹는 사진과 라이트룸,9577,"월 46,900원",사진/영상,MAZECT(마젝)
10,부업/창업/재테크・리뷰요정리남,블로그로 하루 2시간 투자해서 직장인만큼 수익내기!,9226,"월 45,632원",부업/창업/재테크,리뷰요정리남
11,미술・펜크래프트,"사각사각 손글씨의 낭만, 펜크래프트의 한글 정자체 펜글씨",9162,"월 41,898원",미술,펜크래프트
12,부업/창업/재테크・노마드 그레이쓰,"나만의 취미로 돈 버는 방법, 디지털 파일 판매의 모든 것!",8807,"월 39,750원",부업/창업/재테크,노마드 그레이쓰
13,미술・배성규,"마카와 색연필로 그려내는 일상의 기록, 뜻밖의 풍경, 찰나의 순간",8488,"월 49,900원",미술,배성규
14,미술・리니,"마카와 펜, 드로잉북만 들고 떠나요! 마카로 담는 여행의 특별한 기억",8362,"월 56,810원",미술,리니
15,공예・멘티자수,귀여운 동물들로 나만의 소품 완성! 멘티자수와 함께하는 프랑스자수,8055,"월 50,820원",공예,멘티자수
16,사진/영상・안대훈,한 편의 뮤직비디오 같은 안대훈의 여행 영상 제작법,7796,"월 42,980원",사진/영상,안대훈
17,디지털 드로잉・그리지영,나만의 문방구를 차려요! 그리지영의 타블렛으로 굿즈 만들기,7770,"월 30,400원",디지털 드로잉,그리지영
18,디지털 드로잉・사심굿즈,취미를 넘어 굿즈 셀러로! 인쇄물 굿즈 제작과 상품화,7669,"월 39,900원",디지털 드로잉,사심굿즈
19,사진/영상・에디터 기은,에디터 기은과 함께 브이로그로 시작하는 영상편집,7534,"월 34,900원",사진/영상,에디터 기은
20,미술・이현미,"시크하게 그리는 각도의 마법, 이현미의 색연필 인물화",7498,"월 46,533원",미술,이현미
21,디지털 드로잉・그림바지,"새로운 드로잉 기법의 설렘, 레트로 픽셀아트 드로잉",7277,"월 31,960원",디지털 드로잉,그림바지
22,미술・성립,"선과 여백의 작가 성립, 묵직한 질감과 선명한 색감의 오일파스텔",7270,"월 41,900원",미술,성립
23,요리/음료・아이라이크케이크,특별한 날을 더 특별하게! 커스텀 디자인 케이크 마스터 클래스,7215,"월 56,900원",요리/음료,아이라이크케이크
24,사진/영상・류채우(류필),"일상을 동화처럼 표현하는 사진, 오직 아이폰으로만",7217,"월 37,900원",사진/영상,류채우(류필)
25,디지털 드로잉・그림비,일러스트레이터 배성태(그림비)의 달달한 일상드로잉,7201,"월 42,720원",디지털 드로잉,그림비
26,디자인/개발・크리에이터 좐느,크리에이터 좐느의 포토샵의 모든 것,7005,"월 38,900원",디자인/개발,크리에이터 좐느
27,공예・시은맘,코바늘로 인형을 만들자! 시은맘의 꼼지락 작업실,6965,"월 59,900원",공예,시은맘
28,디지털 드로잉・별라랜드,"차근차근, 아이패드로 그리는 미니멀한 손그림 일러스트",6952,"월 42,500원",디지털 드로잉,별라랜드
29,공예・올라라탄,자연을 엮는 올라라탄의 라탄공예 입문,6829,"월 51,574원",공예,올라라탄
30,미술・필림,"전하고 싶은 한 줄, 필림의 딥펜 캘리그래피",6774,"월 45,900원",미술,필림
31,미술・콰야 Qwaya, 다양한 색으로 과감하게 그려보는 콰야의 오일파스텔 드로잉,6583,"월 46,900원",미술,콰야 Qwaya
32,미술・송블리,분위기까지 담아내는 송블리의 색연필 인물화,6555,"월 52,905원",미술,송블리
33,디자인/개발・뮤,네이버 개발자 뮤와 함께하는 내 인생 첫 번째 앱 만들기,6532,"월 43,900원",디자인/개발,뮤
34,부업/창업/재테크・라이프 해커 자청,"15만 유튜버 자청의 자동수익 월 1,000만원 만드는 법",6443,"월 111,298원",부업/창업/재테크,라이프 해커 자청
35,디자인/개발・디자이너 심소연,"디자인부터 인쇄까지, 심소연의 실무 편집디자인",6325,"월 50,560원",디자인/개발,디자이너 심소연
36,부업/창업/재테크・로꾸미,월급으로 만족하지 못하는 분들을 위한 아마존/이베이 입문,6265,"월 39,750원",부업/창업/재테크,로꾸미
37,공예・슬seul,"햇살처럼 따듯한 스테인드글라스, 나의 오늘을 밝혀줘요.",6261,"월 69,900원",공예,슬seul
38,디지털 드로잉・배성규,배성규 작가와 함께 아이패드로 그리는 스물네 번의 보름,6172,"월 51,880원",디지털 드로잉,배성규
39,요리/음료・이런날케이크,소문난 디저트 카페의 남다른 베이킹 비법,6135,"월 54,900원",요리/음료,이런날케이크
40,디지털 드로잉・우동,소중한 기억에 나만의 색을 칠하다 - 일러스트레이터 우동의 디지털 페인팅,6057,"월 46,150원",디지털 드로잉,우동
41,디지털 드로잉・캣빵,아이패드로 시작하는 캣빵의 귀여운 굿즈 만들기,6039,"월 43,880원",디지털 드로잉,캣빵
42,디자인/개발・ㅔㅔㅅ,ㅔㅔㅅ의 파워포인트 연구소에서 함께 PPT에 입덕해요!,5945,"월 49,900원",디자인/개발,ㅔㅔㅅ
43,디지털 드로잉・키츠 (kits.),아이패드 하나로 떠나는 키츠의 아날로그 텍스처 여행,5770,"월 24,880원",디지털 드로잉,키츠 (kits.)
44,디자인/개발・로지킴 Rozy Kim,작품에 다채로움을 더해 독창적인 나만의 아트워크 만들어봐요. 디지털 아트워크 클래스,5754,"월 48,100원",디자인/개발,로지킴 Rozy Kim
45,미술・소보루,눈으로 맛보는 디저트! 소보루의 색연필 클래스,5753,"월 45,284원",미술,소보루
46,미술・둡 ,"종이를 가득 채우는 부드럽고 감각적인 색감, 둡의 채색 인물화",5731,"월 62,329원",미술,둡 
47,음악・그루비룸,지금 가장 새로운 음악,5693,"월 25,233원",음악,그루비룸
48,디지털 드로잉・화유,민두 작가의 이모티콘 제작부터 판매까지!,5681,"월 31,880원",디지털 드로잉,화유
49,공예・쪼만한마을,"쪼만한마을의 레진 공예, 기초부터 민간자격증 발급까지!",5651,"월 54,900원",공예,쪼만한마을
50,디지털 드로잉・221,감정이 가득한 공간을 그림으로 기록합니다. 공간 디지털 일러스트,5605,"월 47,900원",디지털 드로잉,221
51,미술・헬로양갱,"헬로양갱의 차근차근 펜드로잉, 우리의 일상을 알록달록 기록해봐요!",5457,"월 49,561원",미술,헬로양갱
52,디지털 드로잉・인디고,"현실과 환상사이, 그 어딘가를 그려내는 아이패드 드로잉",5422,"월 47,880원",디지털 드로잉,인디고
53,디지털 드로잉・주안,애니메이션의 한 장면 같은 일러스트 그려보기,5372,"월 44,480원",디지털 드로잉,주안
54,공예・woven on looms,테이블용 수직기 디어위버와 함께 시작하는 당신의 위빙 생활,5347,"월 59,900원",공예,woven on looms
55,사진/영상・이모씨,"순간을 더 아름답게, 진한 감성을 담는 사진&라이트룸 보정법",5303,"월 41,900원",사진/영상,이모씨
56,디지털 드로잉・람다람,"람다람의 레트로 애니메이션, 그리고 편집하며 이야기 담아내기",5247,"월 63,700원",디지털 드로잉,람다람
57,공예・아포코팡파레,아포코팡파레의 비즈와 자수로 만드는 여름 메시백,5164,"월 42,900원",공예,아포코팡파레
58,미술・libere_nuage,색의 규칙을 만들다 - 색연필 인물화로 나만의 색감을 찾아 떠나는 여정,5154,"월 44,900원",미술,libere_nuage
59,요리/음료・솜솜,어서오세요! 여기는 솜솜네 홈카페입니다.,5110,"월 39,500원",요리/음료,솜솜
60,디지털 드로잉・유나나,애니메이션 속 주인공 같은 캐릭터를 타블렛으로 탄생시켜요!,5108,"월 44,900원",디지털 드로잉,유나나
61,디지털 드로잉・윤지,"사랑을 담아 그리는 순정 일러스트, 이야기를 말하는 캐릭터 드로잉",5101,"월 52,860원",디지털 드로잉,윤지
62,미술・bynaeng,"색연필의 따뜻한 결, 바이냉과 함께하는 매일 손그림 하나",5093,"월 49,900원",미술,bynaeng
63,공예・소소한날,"가위질 소리가 기막히게 좋은 날, 소소한날과 함께하는 재봉 입문",5089,"월 52,900원",공예,소소한날
64,미술・라일라,"묵직하고 선명하게 전해지는 감동, 라일라의 유화 페인팅",5030,"월 63,500원",미술,라일라
65,사진/영상・김메주,순간을 기록하는 새로운 방법. 영상 제작의 A to Z ,5032,"월 41,900원",사진/영상,김메주
66,디지털 드로잉・달콩,"색연필도 되고, 물감도 되는 아이패드 일러스트의 모든 것",4995,"월 51,780원",디지털 드로잉,달콩
67,공예・고유,주얼리 디자이너에게 배우는 감각적인 실버주얼리 공예,4974,"월 79,416원",공예,고유
68,공예・블뤼떼 BLUTE,"조향사에게 배우는 조향 기초, 나만의 향기를 만들어요.",4978,"월 59,900원",공예,블뤼떼 BLUTE
69,미술・메리진,"사각사각, 소리마저 행복한 메리진의 마카드로잉",4949,"월 53,900원",미술,메리진
70,미술・스놉,스놉의 단정한 손글씨로 마음을 담은 필사하기,4910,"월 43,900원",미술,스놉
71,디지털 드로잉・이공,일러스트레이터 이공과 함께 나만의 미니 굿즈 제작하기,4907,"월 35,900원",디지털 드로잉,이공
72,디지털 드로잉・반지수,"공간에 포근한 분위기를 불어넣어요, 반지수와 함께하는 아이패드 드로잉",4872,"월 43,900원",디지털 드로잉,반지수
73,부업/창업/재테크・온라인탑셀러,"무자본, 무재고로 중국 구매 대행 사업/부업 시작하기",4797,"월 43,058원",부업/창업/재테크,온라인탑셀러
74,요리/음료・꽁블,"꽁블의 쿠킹클래스, 전세계의 가정식을 배워보자",4744,"월 49,900원",요리/음료,꽁블
75,라이프 스타일・김현경,"기획에서 편집 디자인, 유통까지, 독립출판!",4736,"월 36,900원",라이프 스타일,김현경
76,공예・오키프,"소중한 나를 위해, 직접 만드는 특별한 천연 비누",4717,"월 59,900원",공예,오키프
77,공예・메종드윤(가능성발명가),"전통의 아름다움, 메종드윤과 함께 만드는 한복 장신구",4665,"월 63,900원",공예,메종드윤(가능성발명가)
78,디지털 드로잉・동글,"또 다른 나를 그리다, 동글의 아이패드 캐릭터 드로잉",4663,"월 51,780원",디지털 드로잉,동글
79,디지털 드로잉・페사,사이툴로 그리는 일러스트레이터 페사의 따뜻한 캐릭터 드로잉,4605,"월 57,780원",디지털 드로잉,페사
80,시그니처・유튜버,100만 구독자를 만드는 유튜브 채널의 비밀,4587,"월 22,900원",시그니처,유튜버
81,디자인/개발・수목원,"생각을 구조화하고 디자인하다, 포스터를 만들면서 배우는 그래픽 디자인",4524,"월 39,900원",디자인/개발,수목원
82,공예・스튜디오 랩딥,"퇴근 후 만나는 나의 가죽 공방, 가죽 공예 기초부터 완성까지!",4501,"월 64,760원",공예,스튜디오 랩딥
83,부업/창업/재테크・송사무장,월세 수익 300만 원을 만드는 송사무장의 부동산 투자법! ,4474,"월 27,740원",부업/창업/재테크,송사무장
84,디지털 드로잉・나무13,Back to the Retro!나무13과 함께 레트로아이패드드로잉,4474,"월 49,880원",디지털 드로잉,나무13
85,디지털 드로잉・다야(daya),"꿈꾸던 동화 속 세상, 아이패드로 그려내기",4430,"월 44,480원",디지털 드로잉,다야(daya)
86,사진/영상・빨간토마토,60만 유튜버가 알려주는 가장 쉬운 유튜브 입문기!,4424,"월 33,920원",사진/영상,빨간토마토
87,미술・약국,"약국과 함께 펜 하나로 그리는 분위기 있는 인물, 나만의 세계",4392,"월 46,900원",미술,약국
88,요리/음료・송셰프,혼자서도 잘해요! 송송송 송셰프와 함께하는 혼밥 요리교실,4371,"월 39,900원",요리/음료,송셰프
89,요리/음료・Nana,"테이블 가득 채워내는 홈베이킹, 나나와 함께 달달함을 나누는 디저트",4375,"월 48,900원",요리/음료,Nana
90,디지털 드로잉・광팔,광팔의 아이패드로 귀염통통 카카O톡 이모티콘 만들기,4368,"월 32,780원",디지털 드로잉,광팔
91,미술・sketch_forum ,"건축가에게 배우는 남다른 공간감, 어반스케치 펜드로잉 입문",4351,"월 45,404원",미술,sketch_forum 
92,디지털 드로잉・김이영,글씨 쓰는 김이영과 함께 아이패드에 그려낸 캘리그라피,4335,"월 51,780원",디지털 드로잉,김이영
93,부업/창업/재테크・타임퍼센트,"AI 자동 투자 봇 만들기, 노트북 하나로 월급을 두 배 불리는 비법",4327,"월 66,446원",부업/창업/재테크,타임퍼센트
94,미술・hyunpeach_,현피치와 함께 선명하게 그리는 색연필 인물화 클래스,4327,"월 45,900원",미술,hyunpeach_
95,공예・메리메이드,"종이로 피워낸 낭만, 메리메이드와 함께하는 페이퍼 플라워",4326,"월 54,900원",공예,메리메이드
96,공예・바이브리(byBri),보송보송 코바늘 동물 세상! 바이브리와 함께 떠봐요.,4315,"월 55,929원",공예,바이브리(byBri)
97,미술・엘리,"따뜻함으로 가득 채운 한 장, 엘리와 함께하는 색연필 드로잉",4279,"월 36,900원",미술,엘리
98,공예・Knit Whale,"내 손이 뜨개 도구가 되는, 니트웨일의 암니팅",4281,"월 89,223원",공예,Knit Whale
99,디자인/개발・Doyo(도요),레이어에 담아낸 상상. 크리에이터 Doyo의 포토샵 콜라주,4262,"월 43,900원",디자인/개발,Doyo(도요)
100,공예・후아유네,꽃 자수로 내 마음에 잔잔한 행복을 수 놓아요,4265,"월 36,900원",공예,후아유네
101,디지털 드로잉・규멩,"캐릭터를 살아 숨쉬게 하기, 프로 애니메이션 감독의 스토리 비주얼 라이징",4247,"월 56,700원",디지털 드로잉,규멩
102,부업/창업/재테크・칙스토리 김종영,자영업자를 위한 매출로 이어지는 인스타그램 마케팅,4231,"월 36,442원",부업/창업/재테크,칙스토리 김종영
103,음악・알찬ALCHAN,언제 어디서나 힐링악기 칼림바와 함께 마음을 두드려요,4230,"월 41,400원",음악,알찬ALCHAN
104,사진/영상・경훈,스마트폰으로 만들어내는 사진의 모든 것,4192,"월 43,200원",사진/영상,경훈
105,디지털 드로잉・은비(EUNBI),디즈니풍 캐릭터로 살아있는 애니메이션의 한 장면 그리기,4189,"월 40,880원",디지털 드로잉,은비(EUNBI)
106,라이프 스타일・오미아트,누구나 그림책 작가가 될 수 있어요! 오미아트와 함께하는 그림책 기획과 출판,4175,"월 37,900원",라이프 스타일,오미아트
107,사진/영상・23iii,"아날로그 감성, 영화 퀄리티로 완성하는 브이로그와 뮤비 제작",4164,"월 41,900원",사진/영상,23iii
108,시그니처・센스홍,세상에서 제일 작은 도화지,4123,"월 20,733원",시그니처,센스홍
109,요리/음료・dalas다라스,"고기는 포기해도, 디저트는 포기 못할 때! 달콤한 비건 로푸드 디저트",4160,"월 56,900원",요리/음료,dalas다라스
110,공예・비밀장신구,"전통의 현대적 재해석, 비밀장신구와 함께 엮는 전통 매듭 액세서리",4122,"월 49,900원",공예,비밀장신구
111,부업/창업/재테크・김새해 ,"평범한 사람이 돈 만드는 생각의 비밀, 머니 시크릿 ",4096,"월 27,740원",부업/창업/재테크,김새해 
112,디자인/개발・달범이,달범과 함께 블렌더 툴로 만드는 귀여운 3D 친구들,4099,"월 39,900원",디자인/개발,달범이
113,미술・지과자,"사진보다 더 예쁜 인물화를 그려요, 뷰티 일러스트 클래스",4085,"월 51,900원",미술,지과자
114,공예・바이브리(byBri),'바이브리'의 포근포근 코바늘 인형수업,4086,"월 59,900원",공예,바이브리(byBri)
115,디지털 드로잉・식빵뚱냥,식빵뚱냥과 귀염뽀짝 캐릭터 이모티콘 만들기,4080,"월 38,900원",디지털 드로잉,식빵뚱냥
116,부업/창업/재테크・이상한김팀장,"무자본 마케팅의 시작, 네이버 블로그로 월 1,000만원 매출 올리기",4041,"월 61,040원",부업/창업/재테크,이상한김팀장
117,디지털 드로잉・오유,오유의 수채화 같은 아이패드 드로잉 클래스,4004,"월 45,880원",디지털 드로잉,오유
118,미술・양지,"색감을 그리고 질감을 담다, 양지의 색연필 인물화",4000,"월 41,900원",미술,양지
119,시그니처・그레이,"나만의 이야기, 색 그리고 음악",3990,"월 29,950원",시그니처,그레이
120,공예・필드오즈,"사각사각 시간을 담아내는 나무 접시, 우드카빙",3949,"월 86,700원",공예,필드오즈
121,디지털 드로잉・유르," 소소하지만 확실한 행복, 유르의 굿즈 제작부터 판매까지",3905,"월 36,900원",디지털 드로잉,유르
122,라이프 스타일・별쌤&솔쌤,"체형을 바로잡는 자세교정 홈트레이닝, 뷰릿",3888,"월 43,860원",라이프 스타일,별쌤&솔쌤
123,디자인/개발・수수진(프로젝트158),수수진과 함께 애플 기본프로그램으로 도전하는 독립출판,3867,"월 34,900원",디자인/개발,수수진(프로젝트158)
124,디지털 드로잉・보담,사랑하는 작은 것들을 아기자기하게 그려요. 보담의 아이패드 드로잉,3853,"월 45,880원",디지털 드로잉,보담
125,디지털 드로잉・김모밀,"따뜻한 그림일기로 남기는 여행의 순간들, 김모밀의 디지털 드로잉 클래스",3844,"월 26,880원",디지털 드로잉,김모밀
126,공예・서진,직접 만들고 선물하는 재미! 서진과 함께 뜨는 코바늘 수세미,3843,"월 39,899원",공예,서진
127,공예・시옷프로젝트,뻔하지 않게! 나다운 맞춤 생활한복 만들어요.,3819,"월 58,900원",공예,시옷프로젝트
128,디지털 드로잉・예란,빛과 그림자로 채우는 아이패드 일러스트,3800,"월 42,880원",디지털 드로잉,예란
129,사진/영상・이퀄리,여행을 영화처럼 기록하는 이퀄리의 영상 제작법,3774,"월 44,880원",사진/영상,이퀄리
130,공예・mwm수지,색이 춤추는 마블링 도자기 클래스,3751,"월 73,900원",공예,mwm수지
131,디자인/개발・큐리,이성과 감성을 넘나들다. 시선을 사로잡는 브랜드 디자인,3754,"월 45,360원",디자인/개발,큐리
132,공예・향기 공방 센트보틀,센트보틀의 일상에 선물이 되는 향기 만들기,3721,"월 69,876원",공예,향기 공방 센트보틀
133,공예・하민하준맘,"나와 함께하는 가방, 하민하준맘을 따라 코바늘로 떠봐요!",3697,"월 51,157원",공예,하민하준맘
134,디자인/개발・휘핑,휘핑의 모션그래픽 꿈나무를 위한 애프터이펙트의 기초,3646,"월 44,900원",디자인/개발,휘핑
135,공예・마노자수,"입체로 그려나가는 프랑스자수, 마노자수의 자수 일러스트",3646,"월 45,900원",공예,마노자수
136,공예・향기로운 블라썸,언제나 내 곁에 머무를 나만의 향기 ,3616,"월 49,900원",공예,향기로운 블라썸
137,사진/영상・지니포토,지니스타일과 함께 나만의 시선을 간직한 사진 만들기,3595,"월 49,810원",사진/영상,지니포토
138,미술・소은,"인체 드로잉, 사람을 이해하고 마음을 그리다",3602,"월 46,900원",미술,소은
139,공예・바늘이야기 김대리,"탑다운 스웨터를 뜨며 가을, 겨울을 준비해봐요!",3605,"월 51,900원",공예,바늘이야기 김대리
140,공예・코튼클래스,"세상에서 가장 따뜻한, 코튼클래스의 처음 뜨는 나만의 스웨터 ",3599,"월 63,714원",공예,코튼클래스
141,사진/영상・사이,움직임을 통해 메세지를 전달하는 모션 그래픽,3587,"월 27,570원",사진/영상,사이
142,사진/영상・정멜멜,사진가 정멜멜의 가까워지고 멀어지며 나의 세계 편집하기,3566,"월 47,340원",사진/영상,정멜멜
143,디자인/개발・제이슨,"제이슨과 함께, 포토샵으로 만드는 나만의 판타지 세상",3541,"월 33,900원",디자인/개발,제이슨
144,미술・aassam,"포근하고 따뜻하게, 아쌈의 과슈 색연필 일러스트",3520,"월 63,900원",미술,aassam
145,공예・안녕늘보씨,"취향을 담아 만드는 19권의 수제 노트, 안녕늘보씨의 북바인딩",3511,"월 55,899원",공예,안녕늘보씨
146,공예・마르코로호,달달둥근달 할머니에게 매듭 한 번 배워볼텐가?,3507,"월 43,900원",공예,마르코로호
147,공예・위틀띵즈,"나무를 깎아 만드는 귀여운 소품, 위틀띵즈의 우드카빙",3500,"월 41,492원",공예,위틀띵즈
148,디지털 드로잉・소르르,"사랑스러운 패션과 데일리룩, 아이패드로 쉽고 간단하게 그려요",3492,"월 38,880원",디지털 드로잉,소르르
149,미술・HANA,"하루에 하나, HANA와 함께 그리는 작고 귀여운 수채화 그림",3459,"월 44,900원",미술,HANA
150,요리/음료・14일,"매일이 특별해지는 달콤한 마법, 14일의 알록달록 마카롱",3454,"월 56,900원",요리/음료,14일
151,공예・지음,"마음을 위로하는 위빙, 지음의 베틀 생활",3432,"월 44,827원",공예,지음
152,부업/창업/재테크・거상쌤,"20대, 30대를 위한 내 집 마련의 첫걸음, 부동산 공부는 빠를수록 좋다!",3416,"월 50,778원",부업/창업/재테크,거상쌤
153,미술・비비MOM,"영롱한 눈빛까지 그대로, 사랑스러운 고양이 색연필 초상화",3409,"월 37,350원",미술,비비MOM
154,미술・아이린,"손바닥 안에 그려내는 배낭여행자의 기록, 아이린의 여행드로잉 클래스",3389,"월 51,900원",미술,아이린
155,공예・스왈로우굿즈,"실로 그리는 그림, 스왈로우굿즈의 일러스트 프랑스자수",3365,"월 46,900원",공예,스왈로우굿즈
156,미술・강한,"나만의 그림으로 내 삶을 채우다, 강한의 색연필 일러스트",3362,"월 45,145원",미술,강한
157,미술・함형미,"발길이 닿는 곳, 시선이 머무는 것들을 담아요. 함형미의 어반스케치 드로잉",3359,"월 56,340원",미술,함형미
158,미술・ccarmin카아민,크리미한 질감과 독특한 색감으로 표현하는 유화 인물화,3360,"월 47,711원",미술,ccarmin카아민
159,미술・그림쟁이지니,영원히 남을 일상의 기록 - 그림쟁이 지니의 어반스케치,3336,"월 49,900원",미술,그림쟁이지니
160,직무・박신영,[PRO시리즈] 기획하다 - 기획이 막막한 사람들을 위한 기획 입문,3328,"월 41,860원",직무,박신영
161,디지털 드로잉・웨지,"환상 속 세계를 그려봐요, 일러스트레이터 웨지의 디지털 드로잉",3325,"월 49,420원",디지털 드로잉,웨지
162,미술・손은경,"영화 속 한 장면을 색다르게 그려요, 손은경과 함께하는 마카, 색연필 드로잉",3307,"월 39,900원",미술,손은경
163,미술・노보듀스 ,자연스러운 표정과 포즈를 표현해요! 일러스트레이터 노보듀스의 인물 기초 드로잉,3231,"월 46,900원",미술,노보듀스 
164,미술・빈티지걸,빈티지걸의 작고 예쁜 색연필 꽃그림,3225,"월 69,900원",미술,빈티지걸
165,디자인/개발・캘리스마인드(캘마),아이패드로 디자인 해볼래? ,3214,"월 49,000원",디자인/개발,캘리스마인드(캘마)
166,라이프 스타일・호수쌤,내 마음을 제대로 들여다봐요. 마인드 힐링 타로카드,3203,"월 43,900원",라이프 스타일,호수쌤
167,미술・서일환,흑백사진 같은 서일환의 리얼리즘 연필 인물화,3199,"월 39,900원",미술,서일환
168,공예・소소한날,"소소한날과 함께, 우리가 입을 옷을 재봉틀로 직접 지어요.",3198,"월 61,437원",공예,소소한날
