,header,title,favorite,price,category,creator
169,디지털 드로잉・pinn,"상상을 더 정교하게 만드는 선과 채색, 일러스트레이터 핀의 디지털 드로잉",3196,"월 64,980원",디지털 드로잉,pinn
170,디지털 드로잉・그림그리는방,"감성 충전하는 아이패드 드로잉, 그림그리는방과 함께해요",3167,"월 33,880원",디지털 드로잉,그림그리는방
171,미술・모넥스(MMMMONEXX),"기본으로 그리다, 모나미 볼펜 인물 드로잉",3147,"월 37,900원",미술,모넥스(MMMMONEXX)
172,공예・오늘의 그림,'오늘의 그림'과 나만의 감성 네온사인 만들기,3146,"월 54,900원",공예,오늘의 그림
173,디지털 드로잉・조소현,텍스처가 살아있는 따듯한 아이패드 감성 드로잉,3131,"월 42,900원",디지털 드로잉,조소현
174,음악・주니,"홈레코딩 101 : 작사, 작곡부터 싱글발매까지",3115,"월 45,900원",음악,주니
175,미술・산호,"특별한 질감, 진한 여운. 일러스트레이터 산호의 불투명 수채화",3108,"월 38,900원",미술,산호
176,디지털 드로잉・YONGYONG,마우스로 쉽게 그리는 나만의 세상! 용용과 함께하는 일러스트 그리고 애니메이션,3075,"월 41,920원",디지털 드로잉,YONGYONG
177,미술・김루시,따라만 해도 캘리그래퍼! 루시랩의 펜 캘리그라피 완전정복,3064,"월 51,900원",미술,김루시
178,미술・단비스윗레인,"클래식한 아름다움, 단비의 카퍼플레이트 영문 캘리그라피",3055,"월 51,900원",미술,단비스윗레인
179,공예・조이라탄,"조이라탄과 함께, 처음 엮어보는 라탄 공예의 기초",3042,"월 47,900원",공예,조이라탄
180,공예・필드오즈,"나무 그 따뜻함에서 만나는 힐링, 우드카빙",3052,"월 54,900원",공예,필드오즈
181,부업/창업/재테크・단아쌤,"월 100만원 수익! 아이디어스, 스마트스토어에서 월급 외 수익 벌기",3035,"월 43,058원",부업/창업/재테크,단아쌤
182,공예・LOOOP,지친 하루를 다정하게 감싸줄 사계절 니트 양말 뜨기,3029,"월 63,592원",공예,LOOOP
183,공예・쌀이공방,사랑스러운 우리집 강아지 얼굴 만들기! 쌀이공방의 양모펠트,3025,"월 62,375원",공예,쌀이공방
184,공예・노브워크샵,천연 비누로 한 층 한 층 그려내는 풍경,3007,"월 42,042원",공예,노브워크샵
185,미술・그리고화실 수정쌤,"내가 보고 느끼는 그 장면 그대로, 여행스케치의 모든 것",2995,"월 51,900원",미술,그리고화실 수정쌤
186,디지털 드로잉・전구별,전구별과 떠나는 캐릭터 제작과 굿즈 만들기 세상,2996,"월 43,046원",디지털 드로잉,전구별
187,음악・정완 JEONGWAN," 일상을 음악으로 채색해봐요, 최정완과 함께 배우는 어쿠스틱 기타",2977,"월 41,900원",음악,정완 JEONGWAN
188,라이프 스타일・장혜현,언제쯤 내 마음을 글로 표현할 수 있을까?,2966,"월 35,540원",라이프 스타일,장혜현
189,사진/영상・다솜,휴대폰 하나면 충분해요! 인생사진 기록하는 방법,2955,"월 36,900원",사진/영상,다솜
190,공예・수놓는 발바닥,"꽁냥 꽁냥, 고양이는 진리 수놓는 발바닥과 함께 하는 고양이 자수",2968,"월 45,900원",공예,수놓는 발바닥
191,음악・보컬트레이너임선호,'마O무 보컬트레이너' 임선호에게 배우는 보컬 트레이닝,2964,"월 92,900원",음악,보컬트레이너임선호
192,공예・오즈앤엔즈,따뜻한 햇살을 그대로 담아 반짝이는 썬캐쳐 만들기,2957,"월 45,900원",공예,오즈앤엔즈
193,사진/영상・미쿠니스튜디오,포토그래퍼 미쿠니스튜디오와 배우는 카메라 그리고 사진,2942,"월 29,900원",사진/영상,미쿠니스튜디오
194,미술・GARI,마카와 색연필로 완성하는 나의 패션 일러스트 일기장,2929,"월 43,899원",미술,GARI
195,디지털 드로잉・배성규,"너와 내가 그리는 가장 아름다운 순간들, 배성규의 아이패드 드로잉",2916,"월 53,460원",디지털 드로잉,배성규
196,사진/영상・존코바,"더 심화된 모션그래픽, 영상에 전문가처럼 디테일 더하기",2905,"월 54,720원",사진/영상,존코바
197,공예・프리띵(pretthing),"먹지 마세요, 당신의 하루에 양보하세요. 유투버 프리띵의 맛있는 캔들",2899,"월 63,900원",공예,프리띵(pretthing)
198,공예・수밍,"악세사리부터 도일리까지! 내 마음의 쉼터, 태팅레이스",2888,"월 42,900원",공예,수밍
199,공예・별별그림,별별그림의 실크스크린으로 쓱싹 만드는 유니크한 굿즈,2876,"월 43,900원",공예,별별그림
200,디지털 드로잉・NCHO,아이패드와 프로크리에이트로 그리는 눈부시게 화려한 캐릭터 일러스트,2874,"월 49,500원",디지털 드로잉,NCHO
201,사진/영상・스케르잔도,"연출, 촬영, 보정까지! 스케르잔도의 매혹적인 인물 사진의 모든 것",2865,"월 39,900원",사진/영상,스케르잔도
202,디지털 드로잉・김이영,"김이영과 함께, 아이패드로 쓰는 영문 레터링 A to Z",2863,"월 51,880원",디지털 드로잉,김이영
203,미술・여행하는 수수씨,"직접 그리는 여행 엽서, 수수씨와 함께 여행의 순간을 그려요!",2861,"월 35,539원",미술,여행하는 수수씨
204,디자인/개발・뽀디리,"또 다른 첫 인상, 일러스트레이터로 셀프 브랜딩 시작하기",2846,"월 49,900원",디자인/개발,뽀디리
205,공예・가지뜨개,가지뜨개와 함께 포근한 겨울을 뜨자! 패브릭얀으로 배우는 코바늘 클래스,2842,"월 44,900원",공예,가지뜨개
206,공예・새벽달,동글동글 천천히 떠가는 나만의 코바늘 인형,2840,"월 49,900원",공예,새벽달
207,미술・흰 달,"몽환적인 상상을 담은 수채화, 흰달과 함께 꿈을 그려요",2836,"월 41,900원",미술,흰 달
208,공예・투모로우오브젝트(연주),나만의 감각을 담아 탄생하는 단 하나의 실버 주얼리,2819,"월 88,210원",공예,투모로우오브젝트(연주)
209,공예・신양아리,"반짝이는 레진에 담아낸 나의 이야기, 신양아리의 레진아트",2827,"월 46,049원",공예,신양아리
210,디지털 드로잉・정진호작가," 생각을 정리하는 탁월한 기술, 비주얼 씽킹",2812,"월 40,880원",디지털 드로잉,정진호작가
211,부업/창업/재테크・젊은부자마을 유비,뜬구름 잡지 않는 부동산 경매 투자법! 월급쟁이 부자는 없다.,2820,"월 75,148원",부업/창업/재테크,젊은부자마을 유비
212,라이프 스타일・리치메이커 김병인,저렴하게 배워보는 재테크전문가의 How To 재테크!,2809,"월 31,233원",라이프 스타일,리치메이커 김병인
213,디지털 드로잉・뽐뽐 스튜디오,귀염뽀짝 일러스트 굿즈 만들기의 모든 것!,2794,"월 43,880원",디지털 드로잉,뽐뽐 스튜디오
214,요리/음료・chobchop,찹찹테이블의 눈과 입이 행복한 건강식 레시피,2787,"월 43,900원",요리/음료,chobchop
215,공예・조이라탄,"조이라탄과 함께, 다채로운 무늬로 엮어내는 라탄 리빙 소품",2779,"월 58,900원",공예,조이라탄
216,미술・임새봄,색연필로 그리는 달콤한 디저트와 음료 일러스트,2752,"월 42,028원",미술,임새봄
217,공예・SAIDA,"누구나 상상을 현실로 만들 수 있어요, 나만의 커스텀 드레스만들기",2762,"월 74,900원",공예,SAIDA
218,미술・비채,비채와 수채화로 그리는 사랑스러운 꽃 한송이,2743,"월 64,875원",미술,비채
219,사진/영상・슛뚜,"[MINI] 핸드폰으로 만드는 영상, 소중한 시간의 기록",2730,"월 22,900원",사진/영상,슛뚜
220,미술・메그,"일기 쓰듯 한 장 한 장, 마카로 사각사각 데일리 드로잉",2719,"월 34,900원",미술,메그
221,요리/음료・낭만브레드,낭만브레드와 시작하는 행복한 빵 생활!,2709,"월 61,900원",요리/음료,낭만브레드
222,공예・자몽몽,"투명한 레진 속 모든 것이 멈추는 마법, 자몽몽의 레진공예/레진아트",2699,"월 54,899원",공예,자몽몽
223,공예・칠형제,"칠흑 속에서 빛나는 아름다움, 칠형제의 자개 이야기",2699,"월 79,900원",공예,칠형제
224,디지털 드로잉・상상주아,스트레스를 줄이는 일상의 즐거운 상상 그리기!,2689,"월 43,920원",디지털 드로잉,상상주아
225,요리/음료・yona,"요나와 함께하는 재료의 산책, 봄과 여름의 채소 요리",2700,"월 47,900원",요리/음료,yona
226,미술・메리지안,메리지안의 처음만나는 동양화 채색화 꽃그림,2654,"월 66,900원",미술,메리지안
227,공예・오키프,"천연비누, 기초부터 디자인까지 전문적으로 배우자",2651,"월 59,900원",공예,오키프
228,미술・아일렛솔,"따듯한 여행을 그리다, 아일렛솔의 오일파스텔 여행드로잉",2647,"월 42,377원",미술,아일렛솔
229,공예・뤼에르캔들,"세상의 모든 캔들, 방 안을 향기로 채워요.",2644,"월 58,900원",공예,뤼에르캔들
230,요리/음료・고은,"기억하고 싶은 특별한 날을 케이크에 담다, 빈티지 디자인 케이크 ",2632,"월 43,740원",요리/음료,고은
231,미술・선아시,볼펜 한 자루면 충분해요! 선아시와 함께 오늘의 나를 그려요.,2622,"월 29,900원",미술,선아시
232,사진/영상・후지필름연남점,"후지필름과 함께, 미러리스 카메라 100% 활용하기!",2616,"월 39,900원",사진/영상,후지필름연남점
233,공예・페이퍼아티스트 박혜윤,"종이만 있으면 평생 즐기는 취미, 페이퍼아트",2570,"월 49,900원",공예,페이퍼아티스트 박혜윤
234,디지털 드로잉・임동현,프랑스 에이전시 소속 작가가 알려주는 영화 같은 일러스트,2578,"월 41,360원",디지털 드로잉,임동현
235,디지털 드로잉・전희성,"그림과 친해지는 법, 매일 그려보는 라인 드로잉",2545,"월 32,810원",디지털 드로잉,전희성
236,음악・제이엠 (JayM),"피아니스트 제이엠과 함께, 누구나 쉽게 연주하는 피아노",2528,"월 39,920원",음악,제이엠 (JayM)
237,라이프 스타일・무나홈트,필라테스로 만든 하늘하늘거리는 라인,2524,"월 39,900원",라이프 스타일,무나홈트
238,라이프 스타일・양치승,양치승의 지옥 헬스 PT 클래스,2514,"월 28,400원",라이프 스타일,양치승
239,공예・ha:nu(하누),색을 담은 유리의 매력. 하누의 스테인드글라스 클래스,2477,"월 71,300원",공예,ha:nu(하누)
240,미술・펜크래프트,"흘려쓰는 순간 작품이 된다, 펜크래프트의 영문 필기체",2424,"월 44,900원",미술,펜크래프트
241,디자인/개발・E3,취향을 듬뿍 담은 나만의 팔레트 아트워크 만들어봐요,2430,"월 42,900원",디자인/개발,E3
242,라이프 스타일・앤클로써,"앤클로써의 하루 끝을 편안하게 녹여줄 배쓰밤, 버블바",2432,"월 61,900원",라이프 스타일,앤클로써
243,공예・myongs,"소소하지만 확실한 행복, myongs의 미니어처 클래스",2417,"월 51,900원",공예,myongs
244,요리/음료・빈브라더스,All About Coffee! 4가지 도구로 경험하는 다채로운 커피의 세계,2410,"월 65,900원",요리/음료,빈브라더스
245,공예・품프로젝트,품프로젝트의 하루만에 완성하는 나만의 버킷백,2397,"월 29,940원",공예,품프로젝트
246,디지털 드로잉・이모티콘 좋아요,"모찌, 세숑, 바쁘개 이모티콘은 어떻게 만들었을까? 이모티콘 제작 입문!",2397,"월 45,900원",디지털 드로잉,이모티콘 좋아요
247,미술・그레이스캘리,글과 그림에 마음을 담아 - 그레이스캘리의 수채화 캘리그라피,2387,"월 35,900원",미술,그레이스캘리
248,사진/영상・필름로그 film+log,"필름생활 입문, 업사이클 카메라 만들기부터 촬영까지",2369,"월 43,151원",사진/영상,필름로그 film+log
249,미술・도쿠카키,취미 미술의 최강자가 알려주는 투명 색연필 인물화의 7법칙,2383,"월 47,688원",미술,도쿠카키
250,음악・쏜스카이 ,"해금, 특별하고 아름다운 나만의 반려악기",2383,"월 30,160원",음악,쏜스카이 
251,공예・브로보이,"손 바느질로 만드는, 맛있는 패브릭 피규어",2367,"월 46,900원",공예,브로보이
252,라이프 스타일・이봄,이봄의 타로 클래스 ❥ 고민으로 잠 못드는 당신을 위해,2372,"월 49,100원",라이프 스타일,이봄
253,요리/음료・취미로 요리하는 남자,취미로 요리하는 남자의 취미로 하는 수비드 고기 요리,2363,"월 54,040원",요리/음료,취미로 요리하는 남자
254,디지털 드로잉・김웃,"소중했던 여행의 순간들을 기록해요, 김웃과 함께하는 아이패드 드로잉",2357,"월 36,880원",디지털 드로잉,김웃
255,미술・윤꽃,물의 빛깔로 그려내는 사계절 플라워 수채화,2353,"월 49,900원",미술,윤꽃
256,요리/음료・미완성식탁,감각적인 디저트를 완성하다! 마카롱&타르트의 모든 것,2356,"월 56,300원",요리/음료,미완성식탁
257,공예・lovelytatting,복잡할수록 아름다워요. lovelytatting과 함께 태팅 레이스,2346,"월 57,900원",공예,lovelytatting
258,직무・김도현,8년차 에디터에게 배우는 '잘 팔리는' 콘텐츠 제작법,2344,"월 39,198원",직무,김도현
259,디자인/개발・ZESSTYPE(제스타입),글자에 인상을 담아내는 한글 레터링 클래스,2315,"월 49,280원",디자인/개발,ZESSTYPE(제스타입)
260,공예・히소펠트,"니들펠트 기초, 심화, 응용까지 한번에! 히소의 고양이 니들펠트!",2319,"월 54,900원",공예,히소펠트
261,요리/음료・하이디공방,밀가루NO! 쌀가루로 만드는 건강하고 담백한 베이킹,2308,"월 42,325원",요리/음료,하이디공방
262,디지털 드로잉・해란,"디지털로 만들어내는 아날로그 감성, 아이패드 수채화 드로잉",2301,"월 43,880원",디지털 드로잉,해란
263,미술・오유,부담 없이 시작하는 모나미 플러스펜 수채화,2305,"월 53,000원",미술,오유
264,요리/음료・남자의 취미,"맛있게 취하는 입안의 힐링, 집에서 만드는 칵테일 '홈텐딩'",2297,"월 42,917원",요리/음료,남자의 취미
265,공예・녹챠방,내가 원하는 대로! 녹챠방의 DIY 귀걸이 만들기 클래스,2293,"월 34,900원",공예,녹챠방
266,디자인/개발・tOBEY,아트토이로 창조하는 나만의 캐릭터,2291,"월 83,000원",디자인/개발,tOBEY
267,디자인/개발・글자동경,디자이너를 위한 타이포그래피 완전정복 - 레터링,2286,"월 45,310원",디자인/개발,글자동경
268,공예・블랙탄,탄탄한 게 제일 좋아! 블랙탄의 탄탄한 가죽 공예,2262,"월 59,900원",공예,블랙탄
269,공예・데일리컨츄리,"빈티지한 코바늘 손뜨개 소품 만들기, 차근차근 시작해봐요",2263,"월 37,900원",공예,데일리컨츄리
270,미술・이재경,"내가 사랑한 모습 그대로, 이재경의 색연필 반려동물 초상화",2251,"월 47,900원",미술,이재경
271,요리/음료・청미당,"청미당과 함께, 쉽고 건강하고 맛있는 쌀 베이킹",2257,"월 52,720원",요리/음료,청미당
272,디지털 드로잉・달콩, 5가지 스타일을 한 번에! 달콩의 아이패드 드로잉,2241,"월 37,880원",디지털 드로잉,달콩
273,미술・카콜,선과 선이 만나 떠나는 카콜의 어반 스케치 여행,2230,"월 52,260원",미술,카콜
274,디지털 드로잉・리노,리노와 아이패드로 시작하는 디지털캘리그라피,2229,"월 49,800원",디지털 드로잉,리노
275,미술・이고,핑팡퐁의 몽글몽글 마카드로잉 클래스,2232,"월 31,900원",미술,이고
276,공예・미세스미미,"우연이 만들어내는 예술, 미세스미미와 함께하는 플루이드아트",2222,"월 49,900원",공예,미세스미미
277,"미술・choier, 최 형 석",한단계 더 높은 인물화 표현을 위한 해부학 101,2210,"월 46,900원",미술,"choier, 최 형 석"
278,공예・토크어바웃 플라워,토크어바웃과 함께 내 손으로 피워내는 한 다발의 꽃,2207,"월 59,860원",공예,토크어바웃 플라워
279,디지털 드로잉・안토베로,아이패드 프로크리에이트로 인물 모작 시작하기,2196,"월 42,880원",디지털 드로잉,안토베로
280,미술・donghokim,펜 하나로 그날의 기억을 담다. 김동호 작가의 공간 드로잉 ,2198,"월 44,900원",미술,donghokim
281,디지털 드로잉・클래스101,New iPad Pro + 취미 자유이용권 + 선착순 반값 애플펜슬까지! ,2189,"월 91,341원",디지털 드로잉,클래스101
282,디지털 드로잉・수수진(프로젝트158),"디지털 일러스트가 처음인 당신을 위해, 어도비 스케치 드로잉",2180,"월 44,280원",디지털 드로잉,수수진(프로젝트158)
283,요리/음료・어바웃마스,"Make your own rainbow, 어바웃 마스의 홈 카페 기초",2175,"월 40,300원",요리/음료,어바웃마스
284,부업/창업/재테크・효샤,내가 그린 캐릭터로 브랜드 시작하기! 굿즈부터 사업화까지,2169,"월 49,676원",부업/창업/재테크,효샤
285,미술・댄싱스네일,"마음을 예쁘게 칠하는 법, 댄싱스네일의 과슈화",2159,"월 50,220원",미술,댄싱스네일
286,공예・이본느모건 ,한 땀 한 땀  꽃을 수 놓다 - 보태니컬 입체 프랑스 자수,2159,"월 49,900원",공예,이본느모건 
287,라이프 스타일・뷰티피아 ,아름다운 라인을 잡아주는 연예인 경락 마사지,2154,"월 47,794원",라이프 스타일,뷰티피아 
288,라이프 스타일・리지,프로 일잘러를 위한 슬기로운 아이패드 활용법,2155,"월 54,900원",라이프 스타일,리지
289,디지털 드로잉・클래스101,[자유이용권] 6가지 클래스로 아이패드 시작하기 - 입문편,2153,"월 80,266원",디지털 드로잉,클래스101
290,디지털 드로잉・HONGSUK,기초부터 심화까지 탄탄하게 배우는 캐릭터 일러스트,2142,"월 45,900원",디지털 드로잉,HONGSUK
291,디지털 드로잉・연그림,세상 모든 것을 귀엽게! 연그림의 동글동글 타블렛 드로잉,2138,"월 34,900원",디지털 드로잉,연그림
292,라이프 스타일・요니나,"경제적 자유를 위한 첫 시작, 요니나의 가계부 작성법",2131,"월 29,900원",라이프 스타일,요니나
293,디지털 드로잉・클래스101,[자유이용권] 7가지 클래스로 아이패드 200% 즐기기 - 활용편,2129,"월 84,466원",디지털 드로잉,클래스101
294,미술・유미미,"오늘 느끼는 작은 행복, 과슈 드로잉 다이어리",2106,"월 43,800원",미술,유미미
295,디자인/개발・클래스101,모션그래픽 입문 1+1 기초부터 애니메이션까지,2100,"월 30,254원",디자인/개발,클래스101
296,디지털 드로잉・헬로그,쉽고 즐겁게! 직접 그려보는 반려동물 캐릭터,2092,"월 55,654원",디지털 드로잉,헬로그
297,라이프 스타일・유챌유라,"호흡과 명상으로 잡는 균형, 유챌의 호흡 트레이닝",2084,"월 38,712원",라이프 스타일,유챌유라
298,미술・딸비,서랍 속 싸인펜으로 그리는 맛있는 음식 일러스트,2085,"월 37,900원",미술,딸비
299,디지털 드로잉・흐스흐,"아이패드 드로잉의 기초부터 굿즈 제작까지, 따뜻하고 몽글몽글하게 흐스흐와 함께 해요!",2074,"월 44,280원",디지털 드로잉,흐스흐
300,직무・짤막한 강좌,실무자를 위한 바로 써먹는 쉽고 빠른 엑셀,2070,"월 29,826원",직무,짤막한 강좌
301,공예・후화정원,내 손으로 피워내는 꽃!  후화정원의 클레이크림 플라워로 배우는 꽃 파이핑,2054,"월 44,900원",공예,후화정원
302,미술・고고일러스트,"감성을 그립니다, 고고일러스트의 샤프로 그리는 인물 드로잉",2044,"월 44,900원",미술,고고일러스트
303,공예・NOA,내 고양이와 강아지를 위한 마크라메 ,2039,"월 99,750원",공예,NOA
304,디지털 드로잉・유노,누구나 쉽게 그리는 귀엽고 앙증맞은 SD 캐릭터 일러스트,2039,"월 46,440원",디지털 드로잉,유노
305,사진/영상・kyung6film,금손남친 경식스가 알려주는 스마트폰 하나로 영상 만들기,2030,"월 41,900원",사진/영상,kyung6film
306,디지털 드로잉・덕규,평범함 속에서 찾는 재미와 행복! 일러스트레이터 덕규의 디지털 드로잉,2026,"월 34,900원",디지털 드로잉,덕규
307,요리/음료・미뜰리에,"화과자, 달콤함으로 피워내는 한 송이 꽃",2003,"월 54,540원",요리/음료,미뜰리에
308,미술・지과자," 일상을 더욱 특별하게, 지과자의 감성 색연필 일러스트",2010,"월 36,900원",미술,지과자
309,디지털 드로잉・일월,일월과 말랑한 동화이야기를 아이패드로 그려봐요,1994,"월 41,880원",디지털 드로잉,일월
310,음악・박터틀,누구나 손쉽게 따라 하는 재즈피아노 입문 클래스,1986,"월 46,440원",음악,박터틀
311,미술・아쿠픽투라,"붓과 바늘로 그리는 그림, 아쿠픽투라의 수채화 자수",1981,"월 49,900원",미술,아쿠픽투라
312,요리/음료・라르고팩토리,"돈이 되는 달콤한 취미, 앙금 플라워 떡케이크",1973,"월 55,298원",요리/음료,라르고팩토리
313,요리/음료・란들렌,"정성 한 스푼, 애정 한 스푼, 란들렌과 함께하는 홈베이킹",1976,"월 59,900원",요리/음료,란들렌
314,디지털 드로잉・자토,"평범한 일상에 색을 더하는 시간, 자토의 아이패드 드로잉",1969,"월 45,880원",디지털 드로잉,자토
315,부업/창업/재테크・이재웅,현직 뮤비 감독에게 배우는 감각적인 영상 제작법,1961,"월 39,700원",부업/창업/재테크,이재웅
316,미술・hi_fooo,"영문 캘리그라피가 주는 소소한 행복, Lettering Together!",1954,"월 39,900원",미술,hi_fooo
317,디지털 드로잉・오니기리,이모티콘 작가 오니기리와 함께 카카오톡 이모티콘 만들기,1946,"월 34,900원",디지털 드로잉,오니기리
318,요리/음료・널리케이크,"예쁘고, 맛있고, 건강하게! 첨가물 없이 손쉽게 만드는 떡 디저트",1936,"월 58,610원",요리/음료,널리케이크
319,공예・블루도프,"일상을 빛나게, 섬세한 금속 공예로 만나는 핸드메이드 주얼리",1939,"월 93,900원",공예,블루도프
320,공예・라미서울,추억이 담긴 가죽 그리고 나의 작은 공방,1937,"월 59,900원",공예,라미서울
321,라이프 스타일・편블리,손톱 위에 펼쳐지는 나만의 동화! 러블리한 감성 네일 아트,1932,"월 62,900원",라이프 스타일,편블리
322,공예・쭘언니,"콕! 찔러보고 싶은 귀여움, 양모펠트",1923,"월 48,900원",공예,쭘언니
323,미술・조맹,"크로키로 찾아가는 나만의 선, 나만의 드로잉 ",1906,"월 48,900원",미술,조맹
324,미술・김소라,김소라와 함께 내 마음 속 순간을 수채화로 간직해요,1909,"월 50,899원",미술,김소라
325,미술・골드손,유튜버 골드손과 함께 오일파스텔로 그리는 오늘의 한 장면,1910,"월 56,272원",미술,골드손
326,미술・greenut,"greenut의 일상과 여행을 물들이는 수채화, 그리고 드로잉",1901,"월 52,900원",미술,greenut
327,미술・복고풍로맨스,"꽃송이에 복고풍 감성을 담아, 복고풍로맨스의 감성 수채화",1907,"월 46,900원",미술,복고풍로맨스
328,부업/창업/재테크・제제미미,하고싶은 일을 하며 살아보세요. 월급은 에어비앤비가 대신 벌어드립니다!,1896,"월 41,278원",부업/창업/재테크,제제미미
329,공예・스티치랩 소잉 스튜디오,나만의 색깔로 디자이너처럼! 스티치랩과 함께 재봉틀로 만드는 하나뿐인 소품,1893,"월 49,900원",공예,스티치랩 소잉 스튜디오
330,미술・정중원,"현실, 그 이상을 그리다 - 화가 정중원과 함께하는 아크릴 인물화",1885,"월 53,900원",미술,정중원
331,요리/음료・빠다쥬,프랑스 유학파 파티시에의 원리부터 배우는 정통 디저트,1889,"월 54,600원",요리/음료,빠다쥬
332,미술・다혜,섬세한 붓터치로 종이에 물드는 자연스러운 인물수채화,1883,"월 46,900원",미술,다혜
333,미술・러브조이,"모던 레터링, 종이 위를 울리는 펜촉의 리듬",1877,"월 41,900원",미술,러브조이
334,공예・멘티자수,"차분히 즐기는 멘티의 프랑스자수, 6가지 생활소품으로!",1883,"월 59,900원",공예,멘티자수
335,미술・전주영,"조금 삐뚤어도 괜찮아! 무한한 선의 매력, 펜 드로잉",1875,"월 39,900원",미술,전주영
336,미술・쥬드 프라이데이,웹툰 <진눈깨비 소년> 작가 쥬드씨의 오늘밤 시작하는 풍경수채화 ,1869,"월 40,031원",미술,쥬드 프라이데이
337,요리/음료・리화쌤,샐러드로만 한 달을 버틸 수 있는 샐러드 레시피 & 드레싱 클래스,1873,"월 38,900원",요리/음료,리화쌤
338,공예・미나랜드,수틀 안 향기로운 꽃밭을 수놓는 프랑스 자수,1870,"월 44,940원",공예,미나랜드
